{
    "name": "rn",
    "version": "0.5.0",
    "description": "Rename files using regular expressions",
    "namespace": "core",
    "language": "python",
    "platform": "cross-platform",
    "platforms": ["windows", "linux", "macos", "bsd"],
    "runtime": {
        "type": "python",
        "entry_point": "main",
        "script_path": "rn.py"
    },
    "pass_through": true,
    "taxonomy": {
        "category": "file-tools",
        "tags": ["rename", "regex", "batch", "files"]
    },
    "lifecycle": {
        "status": "active"
    }
}
