{
    "name": "vid2gif",
    "version": "0.1.0",
    "description": "High-quality video to GIF via ffmpeg two-pass palette + gifsicle",
    "namespace": "media",
    "language": "python",
    "platform": "cross-platform",
    "platforms": ["windows", "linux", "macos"],
    "runtime": {
        "type": "python",
        "entry_point": "main",
        "script_path": "vid2gif.py"
    },
    "pass_through": false,
    "taxonomy": {
        "category": "media",
        "tags": ["video", "gif", "ffmpeg", "gifsicle", "palette", "provenance:native"]
    },
    "lifecycle": {
        "status": "active"
    }
}
