{
    "name": "vidresize",
    "version": "0.1.0",
    "description": "AR-preserving video resize with metadata strip + audio injection",
    "namespace": "media",
    "language": "python",
    "platform": "cross-platform",
    "platforms": ["windows", "linux", "macos"],
    "runtime": {
        "type": "python",
        "entry_point": "main",
        "script_path": "vidresize.py"
    },
    "pass_through": false,
    "taxonomy": {
        "category": "media",
        "tags": ["video", "resize", "ffmpeg", "audio", "exiftool", "provenance:comfyui"]
    },
    "lifecycle": {
        "status": "active"
    }
}
