{
    "name": "claude-recover-sesslogs",
    "version": "0.1.0",
    "description": "Salvage the logger channels of sessions that worked in a now-missing path -- rank sesslogs by folder-affinity and recover them",
    "namespace": "dazzletools",
    "language": "python",
    "platform": "cross-platform",
    "platforms": ["windows", "linux", "macos"],
    "runtime": {
        "type": "python",
        "entry_point": "main",
        "script_path": "claude_recover_sesslogs.py"
    },
    "pass_through": false,
    "taxonomy": {
        "category": "dev-tools",
        "tags": ["claude", "sesslog", "recovery", "transcript", "salvage", "sessions", "forensics"]
    },
    "lifecycle": {
        "status": "active"
    }
}
